{
  "after": {
    "error_kind": null,
    "libraries_measured": 3,
    "phase": "COMPLETE",
    "status": "PASS"
  },
  "before": {
    "error_kind": null,
    "libraries_measured": 3,
    "phase": "COMPLETE",
    "status": "PASS"
  },
  "build_status": [
    {
      "candidate": "b",
      "deadline_phase": "IMPORT",
      "error": "REQUEST_FAILED",
      "libraries": {
        "cwork-3m": {
          "completed": 29,
          "failed": 0,
          "imported": 30,
          "pending": 1
        },
        "docdb-touqian": {
          "completed": 0,
          "failed": 0,
          "imported": 0,
          "pending": 0
        },
        "spbp-2027": {
          "completed": 0,
          "failed": 0,
          "imported": 0,
          "pending": 0
        }
      },
      "library": "cwork-3m"
    }
  ],
  "candidate_attempts": {
    "a": 0,
    "b": 1
  },
  "candidate_failures": [
    {
      "build_error": "REQUEST_FAILED",
      "candidate": "b",
      "error": "CandidateError"
    }
  ],
  "candidate_log_checks": [
    {
      "all_streams_verified": true,
      "archive_inventory_matches_firewall": true,
      "archived_log_files": 6,
      "candidate": "b",
      "firewall_streams": 6,
      "firewall_verified": true,
      "hit_files": 0,
      "independent_post_scan_hit_files": 0,
      "log_files": 6,
      "logs_retained": true,
      "redaction_count": 9,
      "remaining_owned_runtime": 0,
      "scan_passed": true,
      "workspace_cleanup_complete": true
    }
  ],
  "candidate_results": 0,
  "closeout": {
    "abort": true,
    "after_claim": true,
    "claim": true,
    "cleanup": true,
    "decision": true,
    "helper_script": true,
    "launch": true,
    "terminal": true
  },
  "closeout_status": {
    "error_kind": null,
    "phase": "COMPLETE",
    "status": "INVALID_CLOSED"
  },
  "controller_claims": 1,
  "controller_log_checks": [
    {
      "closed": true,
      "eof": true,
      "error": "CHILD_NONZERO",
      "independent_post_scan_hits": 0,
      "post_scan_hits": 0,
      "redaction_count": 0,
      "verified": false
    }
  ],
  "controller_terminals": 1,
  "executioner_migration_id": "ead5992d-fea7-4efb-b4c5-cedb1d7e8d12",
  "formal": {
    "completed": [],
    "exit_code": 2,
    "failed_phase": "RUN_B",
    "phase": "EXECUTION_ATTEMPT_FAILED",
    "status": "WAITING_RECONCILIATION"
  },
  "global_exposure": 0,
  "ledger": {
    "a": {
      "cwork-3m": {
        "arm": 0,
        "complete": 0,
        "exposure": 0,
        "query_count": 0,
        "result": 0,
        "score": 0
      },
      "docdb-touqian": {
        "arm": 0,
        "complete": 0,
        "exposure": 0,
        "query_count": 0,
        "result": 0,
        "score": 0
      },
      "spbp-2027": {
        "arm": 0,
        "complete": 0,
        "exposure": 0,
        "query_count": 0,
        "result": 0,
        "score": 0
      }
    },
    "b": {
      "cwork-3m": {
        "arm": 0,
        "complete": 0,
        "exposure": 0,
        "query_count": 0,
        "result": 0,
        "score": 0
      },
      "docdb-touqian": {
        "arm": 0,
        "complete": 0,
        "exposure": 0,
        "query_count": 0,
        "result": 0,
        "score": 0
      },
      "spbp-2027": {
        "arm": 0,
        "complete": 0,
        "exposure": 0,
        "query_count": 0,
        "result": 0,
        "score": 0
      }
    }
  },
  "new_window_id": "be3ab168-0568-4d39-a06e-824b4cd26a58",
  "observed_pids": {
    "b_runner_alive": false,
    "b_runner_id": 77425,
    "coordinator_alive": false,
    "coordinator_id": 75780
  },
  "owned_runtime": 0,
  "run_id": "ac1ca0c7-6983-4f6e-91ce-8eb45e7673af",
  "schema": "cwk.rt055.amendment10-observation.v1",
  "task_process_count": 0
}
